MCQ,Choices,Correct
What is generative artificial intelligence capable of generating?,"a: Text, images, videos, or other data | b: Only text | c: Only images | d: Only videos",a
Which of the following is not an example of a generative AI system mentioned in the text?,a: ChatGPT | b: Copilot | c: Google Translate | d: DALL-E,c
What concerns have been raised about the potential misuse of generative AI?,a: Cybercrime | b: Mass replacement of human jobs | c: Use of fake news or deepfakes | d: All of the above,d
"Which year saw the release of GPT-4, which some argue could be viewed as an early version of an artificial general intelligence (AGI) system?",a: 2020 | b: 2021 | c: 2022 | d: 2023,d
"According to a survey, which country is leading the world in adopting generative AI?",a: United States | b: India | c: China | d: Japan,c
